{
  "id": "scam_digital_arrest_ta",
  "name": "Digital Arrest Scam - Police Cyber Cell (Tamil)",
  "language": "ta",
  "type": "scam",
  "expected_verdict": "scam",
  "max_turns": 8,
  "planted_details": {
    "upi_ids": [
      "chennai.police.verify@okaxis"
    ],
    "phone_numbers": [
      "9845012345"
    ],
    "account_numbers": [],
    "ifsc_codes": [],
    "callback_numbers": []
  },
  "caller_script": [
    {
      "turn": 1,
      "role": "caller",
      "intent": "intimidation_authority",
      "text": "வணக்கம், நான் சென்னை மத்திய குற்றப்பிரிவு சைபர் கிரைம் இன்ஸ்பெக்டர் சுந்தரம் பேசுகிறேன். உங்கள் ஆதார் எண்ணைப் பயன்படுத்தி கொரியரில் போதைப்பொருட்கள் கடத்தப்பட்டுள்ளது. நீங்கள் இப்போது டிஜிட்டல் அரெஸ்டில் வைக்கப்பட்டுள்ளீர்கள்."
    },
    {
      "turn": 2,
      "role": "caller",
      "intent": "escalation_threat",
      "text": "அழைப்பைத் துண்டிக்காதீர்கள். உங்கள் வங்கி கணக்குகள் அனைத்தும் முடக்கப்பட உள்ளன. உடனடியாக நீதிமன்ற சரிபார்ப்பு செய்ய வேண்டும்."
    },
    {
      "turn": 3,
      "role": "caller",
      "intent": "financial_demand",
      "text": "சரிபார்ப்பிற்காக ரிசர்வ் வங்கி பாதுகாப்பு கணக்கிற்கு உடனடியாக இருபத்தைந்தாயிரம் ரூபாய் அனுப்ப வேண்டும். உடனே பணம் திரும்ப வந்துவிடும்."
    },
    {
      "turn": 4,
      "role": "caller",
      "intent": "payment_instruction",
      "text": "யுபிஐ ஐடி குறித்துக்கொள்ளுங்கள்: chennai dot police dot verify at the rate ok axis. chennai.police.verify@okaxis."
    },
    {
      "turn": 5,
      "role": "caller",
      "intent": "urgency_and_callback",
      "text": "எங்கள் நேரடி கண்காணிப்பு எண்: ஒன்பது எட்டு நான்கு ஐந்து பூஜ்ஜியம் ஒன்று இரண்டு மூன்று நான்கு ஐந்து. 9845012345."
    }
  ]
}
