{
  "id": "scam_parttime_job_hi",
  "name": "Part-Time Task & Investment Fraud (Hindi)",
  "language": "hi",
  "type": "scam",
  "expected_verdict": "scam",
  "max_turns": 6,
  "planted_details": {
    "upi_ids": [
      "task.earn.direct@okaxis"
    ],
    "account_numbers": [],
    "ifsc_codes": [],
    "phone_numbers": [
      "9123499887"
    ],
    "callback_numbers": []
  },
  "caller_script": [
    {
      "turn": 1,
      "role": "caller",
      "intent": "lucrative_offer",
      "text": "नमस्ते, मैं ग्लोबल रेटिंग्स एजेंसी से बोल रही हूँ। आपको घर बैठे यूट्यूब वीडियो लाइक और गूगल मैप्स रिव्यू करने पर रोज़ाना 3000 से 5000 रुपये मिलेंगे।"
    },
    {
      "turn": 2,
      "role": "caller",
      "intent": "advance_fee_trap",
      "text": "काम शुरू करने और वीआईपी टास्क अनलॉक करने के लिए आपको सिर्फ़ एक हज़ार रुपये सिक्योरिटी डिपॉजिट ट्रांसफर करना है, जो 10 मिनट में 2000 होकर वापस आएगा।"
    },
    {
      "turn": 3,
      "role": "caller",
      "intent": "payment_instruction",
      "text": "अभी तुरंत इस आईडी पर एक हज़ार रुपये भेजिए: task dot earn dot direct at the rate ok axis। task.earn.direct@okaxis।"
    }
  ]
}
